{
  "schema": "https://pipeline-atoms.com/schemas/atom-v1.json",
  "type": "github",
  "id": "pipeline-atoms/github/secret-scan",
  "version": "1.0.0",
  "name": "TruffleHog Secret Scan",
  "description": "Runs TruffleHog secret detection on every push and pull_request to prevent credentials, API keys, and tokens from entering the codebase. Fails the workflow on any verified finding.",
  "runtime": {
    "engine": "github-actions"
  },
  "trigger": "push, pull_request",
  "jobs": ["trufflehog"],
  "uses_secrets": [],
  "authored_by": "convergent-systems-key",
  "tags": ["github-actions", "security", "secrets", "trufflehog"],
  "lifecycle": "stable"
}
