{
  "schema": "https://pipeline-atoms.com/schemas/atom-v1.json",
  "type": "github",
  "id": "pipeline-atoms/github/deploy",
  "version": "1.1.0",
  "name": "Deploy to Cloudflare Pages",
  "description": "Deploys a *-atoms catalog site to Cloudflare Pages on every push to the main branch. Requires CLOUDFLARE_ACCOUNT_TOKEN and CLOUDFLARE_ACCOUNT_ID org-level secrets.",
  "runtime": {
    "engine": "github-actions"
  },
  "trigger": "push",
  "trigger_filter": "branches: [main]",
  "jobs": ["deploy"],
  "uses_secrets": ["CLOUDFLARE_ACCOUNT_TOKEN", "CLOUDFLARE_ACCOUNT_ID"],
  "authored_by": "convergent-systems-key",
  "tags": ["github-actions", "deploy", "cloudflare-pages"],
  "lifecycle": "stable"
}
