{
  "schema": "https://pipeline-atoms.com/schemas/atom-v1.json",
  "type": "github",
  "id": "pipeline-atoms/github/label-sync",
  "version": "1.0.0",
  "name": "Label Sync",
  "description": "Installs the canonical agile label set (agile/epic, agile/feature, agile/story, agile/task, status/*, type/*) from convergent-systems-co/repo-standards. Runs on workflow_dispatch and on a weekly schedule to keep repos aligned with the governance standard.",
  "runtime": {
    "engine": "github-actions"
  },
  "trigger": "workflow_dispatch, schedule",
  "trigger_filter": "schedule: weekly",
  "jobs": ["sync"],
  "uses_secrets": [],
  "authored_by": "convergent-systems-key",
  "tags": ["github-actions", "labels", "governance"],
  "lifecycle": "stable"
}
